question_id,question,context,answer,answer_start,answer_end,title
258,불확실성이 커질수록 어떻게 리스크의 크기가 변하나요? ,"확정된 수익률이 보장되는저축과 달리,투자의 경우는 앞으로 어떤 결과가 발생할지 모르는 상황이므로 필연적으로 리스크가 수반된다. 그리고 불확실성이 커질수록, 즉 큰 수익이 나거나 큰 손실이 발생한 가능성이 높을수록 리스크가 큰 투자가 된다. 재무학에서는 모든 투자자가 리스크를 회피하고자 하는 성향, 즉 리스크 회피적(risk averse)이라고 가정한다. 따라서 리스크가 큰 투자일수록 높은 기대수익률이 예상되는 소위 'high risk high return'이 성립한다. 이때 리스크와 관련된 수익률은 투자 시점에 예상하는 기대수익률(expected return), 즉 사전적 수익률을 의미한다. 사후적 수익률은 투자 결과 실제로 투자자가 실현한 수익률을 가리키기 때문에 결과적으로 리스크가 없다. 따라서 'high risk high return'이란 리스크가 큰 투자를 하면 높은 수익률이 보장된다는 의미가 절대 아니고, 기대수익률이 높아야지만 기꺼이 리스크가 감당하고 투자를 하게 된다는 의미이다.","불확실성이 커질수록, 즉 큰 수익이 나거나 큰 손실이 발생한 가능성이 높을수록 리스크가 큰 투자가 된다",75.0,132.0,258
259,재무학에서 투자자들의 리스크 성향은 어떻게 가정되나요? ,"확정된 수익률이 보장되는저축과 달리,투자의 경우는 앞으로 어떤 결과가 발생할지 모르는 상황이므로 필연적으로 리스크가 수반된다. 그리고 불확실성이 커질수록, 즉 큰 수익이 나거나 큰 손실이 발생한 가능성이 높을수록 리스크가 큰 투자가 된다. 재무학에서는 모든 투자자가 리스크를 회피하고자 하는 성향, 즉 리스크 회피적(risk averse)이라고 가정한다. 따라서 리스크가 큰 투자일수록 높은 기대수익률이 예상되는 소위 'high risk high return'이 성립한다. 이때 리스크와 관련된 수익률은 투자 시점에 예상하는 기대수익률(expected return), 즉 사전적 수익률을 의미한다. 사후적 수익률은 투자 결과 실제로 투자자가 실현한 수익률을 가리키기 때문에 결과적으로 리스크가 없다. 따라서 'high risk high return'이란 리스크가 큰 투자를 하면 높은 수익률이 보장된다는 의미가 절대 아니고, 기대수익률이 높아야지만 기꺼이 리스크가 감당하고 투자를 하게 된다는 의미이다.","재무학에서는 모든 투자자가 리스크를 회피하고자 하는 성향, 즉 리스크 회피적(risk averse)이라고 가정한다",134.0,197.0,259
260,'high risk high return'이란 원리는 무엇을 의미하나요? ,"확정된 수익률이 보장되는저축과 달리,투자의 경우는 앞으로 어떤 결과가 발생할지 모르는 상황이므로 필연적으로 리스크가 수반된다. 그리고 불확실성이 커질수록, 즉 큰 수익이 나거나 큰 손실이 발생한 가능성이 높을수록 리스크가 큰 투자가 된다. 재무학에서는 모든 투자자가 리스크를 회피하고자 하는 성향, 즉 리스크 회피적(risk averse)이라고 가정한다. 따라서 리스크가 큰 투자일수록 높은 기대수익률이 예상되는 소위 'high risk high return'이 성립한다. 이때 리스크와 관련된 수익률은 투자 시점에 예상하는 기대수익률(expected return), 즉 사전적 수익률을 의미한다. 사후적 수익률은 투자 결과 실제로 투자자가 실현한 수익률을 가리키기 때문에 결과적으로 리스크가 없다. 따라서 'high risk high return'이란 리스크가 큰 투자를 하면 높은 수익률이 보장된다는 의미가 절대 아니고, 기대수익률이 높아야지만 기꺼이 리스크가 감당하고 투자를 하게 된다는 의미이다.",리스크가 큰 투자일수록 높은 기대수익률이 예상되는 소위 'high risk high return',203.0,257.0,260
261,사후적 수익률과 기대수익률은 어떤 차이가 있나요? ,"확정된 수익률이 보장되는저축과 달리,투자의 경우는 앞으로 어떤 결과가 발생할지 모르는 상황이므로 필연적으로 리스크가 수반된다. 그리고 불확실성이 커질수록, 즉 큰 수익이 나거나 큰 손실이 발생한 가능성이 높을수록 리스크가 큰 투자가 된다. 재무학에서는 모든 투자자가 리스크를 회피하고자 하는 성향, 즉 리스크 회피적(risk averse)이라고 가정한다. 따라서 리스크가 큰 투자일수록 높은 기대수익률이 예상되는 소위 'high risk high return'이 성립한다. 이때 리스크와 관련된 수익률은 투자 시점에 예상하는 기대수익률(expected return), 즉 사전적 수익률을 의미한다. 사후적 수익률은 투자 결과 실제로 투자자가 실현한 수익률을 가리키기 때문에 결과적으로 리스크가 없다. 따라서 'high risk high return'이란 리스크가 큰 투자를 하면 높은 수익률이 보장된다는 의미가 절대 아니고, 기대수익률이 높아야지만 기꺼이 리스크가 감당하고 투자를 하게 된다는 의미이다.","리스크와 관련된 수익률은 투자 시점에 예상하는 기대수익률(expected return), 즉 사전적 수익률을 의미한다. 사후적 수익률은 투자 결과 실제로 투자자가 실현한 수익률을 가리키기 때문에 결과적으로 리스크가 없다",268.0,390.0,261
262,리스크 프리미엄이 무엇을 의미하나요? ,"예를 들어, 안전한 저축 대신에 주식투자를 선택하는 투자자는 저축 이자율보다는 높은 수익을 기대하고 주식투자를 선택한 것이지만, 주식투자 결과 이자율보다 높은 수익을 얻는다는 보장은 없다. 결과적으로 주식투자를 통해 큰 수익을 얻을 수도 있고 아니면 큰 손실을 입을 수도 있는 것이고, 그중 어떤 결과가 발생할지를 투자 시점에서는 알 수 없다는 것이 바로 리스크인 것이다. 따라서 리스크의 크기에 따라 투자의 기대수익률이 달라진다. 이처럼 리스크에 대한 보상으로 증가하는 기대수익률 부분을 리스크 프리미엄(risk premium)이라고 하고, 투자의 기대수익률은 리스크가 전혀 없는 상태에서의 수익률을 가리키는 무위험 수익률(risk-free rate of return)에 리스크 프리미엄을 합한 값이 된다.",리스크에 대한 보상으로 증가하는 기대수익률 부분을 리스크 프리미엄(risk premium)이라고 하고,246.0,302.0,262
263,투자의 기대수익률은 어떻게 구성되나요? ,"예를 들어, 안전한 저축 대신에 주식투자를 선택하는 투자자는 저축 이자율보다는 높은 수익을 기대하고 주식투자를 선택한 것이지만, 주식투자 결과 이자율보다 높은 수익을 얻는다는 보장은 없다. 결과적으로 주식투자를 통해 큰 수익을 얻을 수도 있고 아니면 큰 손실을 입을 수도 있는 것이고, 그중 어떤 결과가 발생할지를 투자 시점에서는 알 수 없다는 것이 바로 리스크인 것이다. 따라서 리스크의 크기에 따라 투자의 기대수익률이 달라진다. 이처럼 리스크에 대한 보상으로 증가하는 기대수익률 부분을 리스크 프리미엄(risk premium)이라고 하고, 투자의 기대수익률은 리스크가 전혀 없는 상태에서의 수익률을 가리키는 무위험 수익률(risk-free rate of return)에 리스크 프리미엄을 합한 값이 된다.",투자의 기대수익률은 리스크가 전혀 없는 상태에서의 수익률을 가리키는 무위험 수익률(risk-free rate of return)에 리스크 프리미엄을 합한 값이 된다,304.0,395.0,263
264,투자자가 높은 수익을 추구하려면 어떤 선택을 해야 하나요? ,"그리고 투자자는 각자의 투자목적과 리스크 선호도에 따라 높은 수익을 기대하면서 리스크를 감당할 것인지 아니면 낮지만 안정적인 수익을 선택할지를 결정하면 된다. 결국, 안정성을 선호하는 경우에는 리스크가 적은 저축의 비중을 높이고, 높은 수익을 추구한다면 리스크를 떠안고 투자의 비중을 높여야 할 것이다. 기대수익률 = 무위험 수익률 + 리스크 프리미엄","안정성을 선호하는 경우에는 리스크가 적은 저축의 비중을 높이고, 높은 수익을 추구한다면 리스크를 떠안고 투자의 비중을 높여야 할 것이다",93.0,168.0,264
265,안정성과 높은 수익을 추구하는 경우 각각 어떤 투자전략을 선택해야 하나요? ,"그리고 투자자는 각자의 투자목적과 리스크 선호도에 따라 높은 수익을 기대하면서 리스크를 감당할 것인지 아니면 낮지만 안정적인 수익을 선택할지를 결정하면 된다. 결국, 안정성을 선호하는 경우에는 리스크가 적은 저축의 비중을 높이고, 높은 수익을 추구한다면 리스크를 떠안고 투자의 비중을 높여야 할 것이다. 기대수익률 = 무위험 수익률 + 리스크 프리미엄","안정성을 선호하는 경우에는 리스크가 적은 저축의 비중을 높이고, 높은 수익을 추구한다면 리스크를 떠안고 투자의 비중을 높여야 할 것이다",93.0,168.0,265
266,어떤 것이 가장 대표적인 저축상품인가요? ,"가장 대표적인저축상품은 예금이기 때문에 예금을 중심으로 설명하기로 한다. 우리나라에서는 예금을 취급할 수 있는 금융회사가 정해져 있다.은행을 위시하여 상호저축은행, 신용협동조합, 새마을 금고, 농·수·축협, 종합금융회사, 우체국예금 등이 여기에 포함된다. 예금은 크게요구불예금과저축성예금으로 구분된다. 요구불예금은 예금자의 지급 청구가 있으면 조건없이 지급해야 하는 예금으로 고객의 지급결제 편의 도모 또는 일시적 보관을 목적으로 한다. 당좌예금, 보통예금, 공공예금, 국고예금 등이 요구불예금에 속한다. 저축성예금은 저축 및 이자수입을 주된 목적으로 하며 예금의 납입 및 인출방법에 대해 특정 조건이 있는 기한부 예금이다. 정기예금과 금전신탁과 같은 거치식 예금과 정기적금과 같은 적립식 예금이 저축성예금에 속한다. 그 밖에 특정한 목적으로 만들어진 재산형성저축이나 주택청약종합저축 등도 저축성예금으로 간주할 수 있다.",가장 대표적인저축상품은 예금이기 때문에 예금을 중심으로 설명하기로 한다,0.0,39.0,266
267,예금을 취급할 수 있는 금융회사로는 어떤 것들이 있나요? ,"가장 대표적인저축상품은 예금이기 때문에 예금을 중심으로 설명하기로 한다. 우리나라에서는 예금을 취급할 수 있는 금융회사가 정해져 있다.은행을 위시하여 상호저축은행, 신용협동조합, 새마을 금고, 농·수·축협, 종합금융회사, 우체국예금 등이 여기에 포함된다. 예금은 크게요구불예금과저축성예금으로 구분된다. 요구불예금은 예금자의 지급 청구가 있으면 조건없이 지급해야 하는 예금으로 고객의 지급결제 편의 도모 또는 일시적 보관을 목적으로 한다. 당좌예금, 보통예금, 공공예금, 국고예금 등이 요구불예금에 속한다. 저축성예금은 저축 및 이자수입을 주된 목적으로 하며 예금의 납입 및 인출방법에 대해 특정 조건이 있는 기한부 예금이다. 정기예금과 금전신탁과 같은 거치식 예금과 정기적금과 같은 적립식 예금이 저축성예금에 속한다. 그 밖에 특정한 목적으로 만들어진 재산형성저축이나 주택청약종합저축 등도 저축성예금으로 간주할 수 있다.",우리나라에서는 예금을 취급할 수 있는 금융회사가 정해져 있다,41.0,74.0,267
268,예금은 어떤 두 가지로 구분되나요? ,"가장 대표적인저축상품은 예금이기 때문에 예금을 중심으로 설명하기로 한다. 우리나라에서는 예금을 취급할 수 있는 금융회사가 정해져 있다.은행을 위시하여 상호저축은행, 신용협동조합, 새마을 금고, 농·수·축협, 종합금융회사, 우체국예금 등이 여기에 포함된다. 예금은 크게요구불예금과저축성예금으로 구분된다. 요구불예금은 예금자의 지급 청구가 있으면 조건없이 지급해야 하는 예금으로 고객의 지급결제 편의 도모 또는 일시적 보관을 목적으로 한다. 당좌예금, 보통예금, 공공예금, 국고예금 등이 요구불예금에 속한다. 저축성예금은 저축 및 이자수입을 주된 목적으로 하며 예금의 납입 및 인출방법에 대해 특정 조건이 있는 기한부 예금이다. 정기예금과 금전신탁과 같은 거치식 예금과 정기적금과 같은 적립식 예금이 저축성예금에 속한다. 그 밖에 특정한 목적으로 만들어진 재산형성저축이나 주택청약종합저축 등도 저축성예금으로 간주할 수 있다.",예금은 크게요구불예금과저축성예금으로 구분된다,143.0,167.0,268
269,요구불예금과 저축성예금의 차이점은 무엇인가요? ,"가장 대표적인저축상품은 예금이기 때문에 예금을 중심으로 설명하기로 한다. 우리나라에서는 예금을 취급할 수 있는 금융회사가 정해져 있다.은행을 위시하여 상호저축은행, 신용협동조합, 새마을 금고, 농·수·축협, 종합금융회사, 우체국예금 등이 여기에 포함된다. 예금은 크게요구불예금과저축성예금으로 구분된다. 요구불예금은 예금자의 지급 청구가 있으면 조건없이 지급해야 하는 예금으로 고객의 지급결제 편의 도모 또는 일시적 보관을 목적으로 한다. 당좌예금, 보통예금, 공공예금, 국고예금 등이 요구불예금에 속한다. 저축성예금은 저축 및 이자수입을 주된 목적으로 하며 예금의 납입 및 인출방법에 대해 특정 조건이 있는 기한부 예금이다. 정기예금과 금전신탁과 같은 거치식 예금과 정기적금과 같은 적립식 예금이 저축성예금에 속한다. 그 밖에 특정한 목적으로 만들어진 재산형성저축이나 주택청약종합저축 등도 저축성예금으로 간주할 수 있다.",요구불예금은 예금자의 지급 청구가 있으면 조건없이 지급해야 하는 예금으로 고객의 지급결제 편의 도모 또는 일시적 보관을 목적으로 한다,169.0,243.0,269
270,우리나라의 금융거래는 어떤 법에 의해 규정되어 있나요? ,"이러한 예금은 일부 특정인 또는 기업에만 허용되는 경우를 제외하면 누구나 앞서 언급한 예금취급금융회사에 가서 통장을 개설하면 거래할 수 있다. 다만, 우리나라는 '금융실명거래 및 비밀보장에 관한 법률'에 의하여 금융거래는 반드시 실명으로 거래하도록 되어 있다. 따라서 예금통장을 개설할 경우에도 반드시 본인임을 확인하고 거래하도록 되어 있고, 본인 명의 통장을 타인에게 대여하는 소위 '대포통장'은 불법이기 때문에 이를 빌려주는 측과 빌려서 사용하는 측 모두 처벌을 받게 된다. 특히 최근 취업난, 등록금 부담 등으로 어려움을 겪고 있는 대학생의 현실을 이용하여 대포통장을 빌려주거나 또는 전달, 제3자에게 운송하는 등의 대가로 금전을 지급한다는 유혹이 많은데 절대 이에 응해서는 안 된다. 통장의 명의자와 사용자가 다른 통장을 대포통장이라고 한다.",우리나라는 '금융실명거래 및 비밀보장에 관한 법률'에 의하여 금융거래는 반드시 실명으로 거래하도록 되어 있다.,84.0,145.0,270
271,예금통장 개설 시 본인 확인을 받는 이유는 무엇인가요? ,"이러한 예금은 일부 특정인 또는 기업에만 허용되는 경우를 제외하면 누구나 앞서 언급한 예금취급금융회사에 가서 통장을 개설하면 거래할 수 있다. 다만, 우리나라는 '금융실명거래 및 비밀보장에 관한 법률'에 의하여 금융거래는 반드시 실명으로 거래하도록 되어 있다. 따라서 예금통장을 개설할 경우에도 반드시 본인임을 확인하고 거래하도록 되어 있고, 본인 명의 통장을 타인에게 대여하는 소위 '대포통장'은 불법이기 때문에 이를 빌려주는 측과 빌려서 사용하는 측 모두 처벌을 받게 된다. 특히 최근 취업난, 등록금 부담 등으로 어려움을 겪고 있는 대학생의 현실을 이용하여 대포통장을 빌려주거나 또는 전달, 제4자에게 운송하는 등의 대가로 금전을 지급한다는 유혹이 많은데 절대 이에 응해서는 안 된다. 통장의 명의자와 사용자가 다른 통장을 대포통장이라고 한다.","따라서 예금통장을 개설할 경우에도 반드시 본인임을 확인하고 거래하도록 되어 있고, 본인 명의 통장을 타인에게 대여하는 소위 '대포통장'은 불법이기 때문에 이를 빌려주는 측과 빌려서 사용하는 측 모두 처벌을 받게 된다.",146.0,267.0,271
272,'대포통장'이란 무엇을 의미하나요? ,"대포통장이 금융사기 등 범죄행위에 악용되는 경우 통장을 사용한 사기꾼 등은 물론 통장주인에게도 민·형사상 책임을 물을 수 있으므로 본인의 예금통장 관리에 스스로 주의해야 한다. 대포통장을 이용한 금융사기의 주요 사례는 '고액알바' 등의 문구로 대학생 및 취업준비생 등을 모집한 후 사기로 모은 돈을 인출하거나 송금하는 역할을 시키거나, 사례금을 지불하겠다며 예금통장을 건네받아 대포통장으로 이용하는 경우 등이 있다. 이처럼 통장을 대여하거나 양도하여 대포통장으로 이용되면 빌려줄 당시에 통장이 범죄에 악용될 것을 몰랐다 하더라도 통장 주인은 전자금융거래법에 따라 3년 이하의 징역이나 2천만원 이하의 벌금에 처해질 수 있으며, 신규통장 개설이 제한되거나 인터넷뱅킹과 같이 은행창구를 이용하지 않고 금융거래를 하는 비대면 거래를 할 수 없는 등 어려움을 겪을 수 있다.",대포통장이 금융사기 등 범죄행위에 악용되는 경우 통장을 사용한 사기꾼 등은 물론 통장주인에게도 민·형사상 책임을 물을 수 있으므로 본인의 예금통장 관리에 스스로 주의해야 한다,0.0,97.0,272
273,대포통장이 금융사기에 어떻게 악용되는 경우가 있는가요? ,"대포통장이 금융사기 등 범죄행위에 악용되는 경우 통장을 사용한 사기꾼 등은 물론 통장주인에게도 민·형사상 책임을 물을 수 있으므로 본인의 예금통장 관리에 스스로 주의해야 한다. 대포통장을 이용한 금융사기의 주요 사례는 '고액알바' 등의 문구로 대학생 및 취업준비생 등을 모집한 후 사기로 모은 돈을 인출하거나 송금하는 역할을 시키거나, 사례금을 지불하겠다며 예금통장을 건네받아 대포통장으로 이용하는 경우 등이 있다. 이처럼 통장을 대여하거나 양도하여 대포통장으로 이용되면 빌려줄 당시에 통장이 범죄에 악용될 것을 몰랐다 하더라도 통장 주인은 전자금융거래법에 따라 3년 이하의 징역이나 3천만원 이하의 벌금에 처해질 수 있으며, 신규통장 개설이 제한되거나 인터넷뱅킹과 같이 은행창구를 이용하지 않고 금융거래를 하는 비대면 거래를 할 수 없는 등 어려움을 겪을 수 있다.","대포통장을 이용한 금융사기의 주요 사례는 '고액알바' 등의 문구로 대학생 및 취업준비생 등을 모집한 후 사기로 모은 돈을 인출하거나 송금하는 역할을 시키거나, 사례금을 지불하겠다며 예금통장을 건네받아 대포통장으로 이용하는 경우 등이 있다",99.0,231.0,273
274,대포통장을 이용해 범죄에 가담한다면 어떤 처벌을 받을 수 있나요? ,"대포통장이 금융사기 등 범죄행위에 악용되는 경우 통장을 사용한 사기꾼 등은 물론 통장주인에게도 민·형사상 책임을 물을 수 있으므로 본인의 예금통장 관리에 스스로 주의해야 한다. 대포통장을 이용한 금융사기의 주요 사례는 '고액알바' 등의 문구로 대학생 및 취업준비생 등을 모집한 후 사기로 모은 돈을 인출하거나 송금하는 역할을 시키거나, 사례금을 지불하겠다며 예금통장을 건네받아 대포통장으로 이용하는 경우 등이 있다. 이처럼 통장을 대여하거나 양도하여 대포통장으로 이용되면 빌려줄 당시에 통장이 범죄에 악용될 것을 몰랐다 하더라도 통장 주인은 전자금융거래법에 따라 3년 이하의 징역이나 4천만원 이하의 벌금에 처해질 수 있으며, 신규통장 개설이 제한되거나 인터넷뱅킹과 같이 은행창구를 이용하지 않고 금융거래를 하는 비대면 거래를 할 수 없는 등 어려움을 겪을 수 있다.",대포통장이 금융사기 등 범죄행위에 악용되는 경우 통장을 사용한 사기꾼 등은 물론 통장주인에게도 민·형사상 책임을 물을 수 있으므로 본인의 예금통장 관리에 스스로 주의해야 한다,0.0,97.0,274
275,대학생이 통장을 잘 관리하는 이유는 무엇인가요? ,따라서 앞으로 활발한 사회생활을 시작해야 하는 대학생 입장에서 잠깐의 사기범의 유혹에 빠져 각종 금융생활에 제약을 받는 일이 없도록 통장관리에 유의하도록 하자.,앞으로 활발한 사회생활을 시작해야 하는 대학생 입장에서 잠깐의 사기범의 유혹에 빠져 각종 금융생활에 제약을 받는 일이 없도록 통장관리에 유의하도록 하자,4.0,88.0,275
276,기업이 자금을 조달하려면 어떤 방식으로 주식을 발행하게 되나요? ,"창업 초기의 기업은 소수의 특정인에게 주식을 발행하여 자금을 조달하게 된다. 그러다가 기업이 성장하고 보다 많은 자금이 필요해지면 주식을 거래소에서 거래하기 위해 불특정다수인을 대상으로 주식을 모집 또는 매출하는 기업공개(IPO: initial public offering)를 하게 된다. 이때부터 누구나 거래소를 통해 이 기업의 주식을 자유롭게 매매할 수 있게 되고, 기업은 자금이 필요해지면 유상증자를 통해 추가적으로 주식을 발행할 수 있게 된다. 이와 같이 기업이 새로운 주식을 발행하여 장기적으로 자기자본을 조달하는 시장을 주식 발행시장(primary market)이라고 한다. 주식을 발행하는 방법에는 직접발행과 간접발행 두 가지가 있다. 직접발행은 발행기업이 중개기관을 거치지 않고 투자자에게 직접 주식을 팔아서 자금을 조달하는 방식으로 유상증자를 통해 기존 주주 또는 제3자에게 주식을 배정하는 경우에 주로 사용된다.",창업 초기의 기업은 소수의 특정인에게 주식을 발행하여 자금을 조달하게 된다,0.0,41.0,276
277,기업이 더 많은 자금이 필요할 때 무엇을 하게 되나요? ,"창업 초기의 기업은 소수의 특정인에게 주식을 발행하여 자금을 조달하게 된다. 그러다가 기업이 성장하고 보다 많은 자금이 필요해지면 주식을 거래소에서 거래하기 위해 불특정다수인을 대상으로 주식을 모집 또는 매출하는 기업공개(IPO: initial public offering)를 하게 된다. 이때부터 누구나 거래소를 통해 이 기업의 주식을 자유롭게 매매할 수 있게 되고, 기업은 자금이 필요해지면 유상증자를 통해 추가적으로 주식을 발행할 수 있게 된다. 이와 같이 기업이 새로운 주식을 발행하여 장기적으로 자기자본을 조달하는 시장을 주식 발행시장(primary market)이라고 한다. 주식을 발행하는 방법에는 직접발행과 간접발행 두 가지가 있다. 직접발행은 발행기업이 중개기관을 거치지 않고 투자자에게 직접 주식을 팔아서 자금을 조달하는 방식으로 유상증자를 통해 기존 주주 또는 제4자에게 주식을 배정하는 경우에 주로 사용된다.",보다 많은 자금이 필요해지면 주식을 거래소에서 거래하기 위해 불특정다수인을 대상으로 주식을 모집 또는 매출하는 기업공개(IPO: initial public offering)를 하게 된다,57.0,160.0,277
