question_id,question,context,answer,answer_start,answer_end,title
808,위험관리란 무엇을 최소화하기 위한 조직적 활동으로 정의될 수 있나요? ,"위험관리(risk management)란 개인이나 조직이 직면한 위험, 즉 예상하지 못한 손실이 가져올 수 있는 좋지 않은 영향의 최소화 목적으로 행하여지는 조직적·체계적 활동으로 정의할 수 있다. 즉, 위험관리는 합리적이고 과학적인 원칙하에 일관성 있게 이루어진다는 의미에서 체계적인 경영활동의 한 형태라고 할 수 있다. 위험은 잠재적인 손실의 가능성으로 정의할 수 있으므로 위험의 크기는 잠재적인 손실발생의 빈도와 발생한 손실의 강도라는 두 가지 요소로 구분해서 생각해 볼 수 있다. 따라서 위험의 크기와 관련된 잠재적 손실의 총규모는 손실의 빈도와 강도의 곱으로 생각할 수 있다. 위험의 크기 = 손실의 빈도(frequency) × 손실의 강도(severity) 따라서 손실의 빈도와 손실의 강도는 위험에 대한 대응방법, 즉 위험의 관리방법을 결정하는 데 중요한 기본적인 고려사항이 된다. 따라서 위험을 이러한 두 요소에 따라 4가지 유형의 위험으로 나누어 생각해 볼 수 있다. 4가지 기본유형 중에서 유형Ⅰ은 잠재적 손실발생빈도와 발생한 손실의 규모가 모두 큰 경우를 말한다.","위험관리(risk management)란 개인이나 조직이 직면한 위험, 즉 예상하지 못한 손실이 가져올 수 있는 좋지 않은 영향의 최소화 목적으로 행하여지는 조직적·체계적 활동으로 정의할 수 있다.",0.0,110.0,808
809,위험의 크기를 어떻게 구분해서 생각할 수 있나요? ,"위험관리(risk management)란 개인이나 조직이 직면한 위험, 즉 예상하지 못한 손실이 가져올 수 있는 좋지 않은 영향의 최소화 목적으로 행하여지는 조직적·체계적 활동으로 정의할 수 있다. 즉, 위험관리는 합리적이고 과학적인 원칙하에 일관성 있게 이루어진다는 의미에서 체계적인 경영활동의 한 형태라고 할 수 있다. 위험은 잠재적인 손실의 가능성으로 정의할 수 있으므로 위험의 크기는 잠재적인 손실발생의 빈도와 발생한 손실의 강도라는 두 가지 요소로 구분해서 생각해 볼 수 있다. 따라서 위험의 크기와 관련된 잠재적 손실의 총규모는 손실의 빈도와 강도의 곱으로 생각할 수 있다. 위험의 크기 = 손실의 빈도(frequency) × 손실의 강도(severity) 따라서 손실의 빈도와 손실의 강도는 위험에 대한 대응방법, 즉 위험의 관리방법을 결정하는 데 중요한 기본적인 고려사항이 된다. 따라서 위험을 이러한 두 요소에 따라 4가지 유형의 위험으로 나누어 생각해 볼 수 있다. 5가지 기본유형 중에서 유형Ⅰ은 잠재적 손실발생빈도와 발생한 손실의 규모가 모두 큰 경우를 말한다.",위험의 크기는 잠재적인 손실발생의 빈도와 발생한 손실의 강도라는 두 가지 요소로 구분해서 생각해 볼 수 있다.,211.0,272.0,809
810,위험의 크기는 어떤 두 가지 요소로 나눠서 생각할 수 있나요? ,"위험관리(risk management)란 개인이나 조직이 직면한 위험, 즉 예상하지 못한 손실이 가져올 수 있는 좋지 않은 영향의 최소화 목적으로 행하여지는 조직적·체계적 활동으로 정의할 수 있다. 즉, 위험관리는 합리적이고 과학적인 원칙하에 일관성 있게 이루어진다는 의미에서 체계적인 경영활동의 한 형태라고 할 수 있다. 위험은 잠재적인 손실의 가능성으로 정의할 수 있으므로 위험의 크기는 잠재적인 손실발생의 빈도와 발생한 손실의 강도라는 두 가지 요소로 구분해서 생각해 볼 수 있다. 따라서 위험의 크기와 관련된 잠재적 손실의 총규모는 손실의 빈도와 강도의 곱으로 생각할 수 있다. 위험의 크기 = 손실의 빈도(frequency) × 손실의 강도(severity) 따라서 손실의 빈도와 손실의 강도는 위험에 대한 대응방법, 즉 위험의 관리방법을 결정하는 데 중요한 기본적인 고려사항이 된다. 따라서 위험을 이러한 두 요소에 따라 4가지 유형의 위험으로 나누어 생각해 볼 수 있다. 6가지 기본유형 중에서 유형Ⅰ은 잠재적 손실발생빈도와 발생한 손실의 규모가 모두 큰 경우를 말한다.",위험의 크기는 잠재적인 손실발생의 빈도와 발생한 손실의 강도라는 두 가지 요소로 구분해서 생각해 볼 수 있다.,211.0,272.0,810
811,위험의 크기를 나타내는 공식은 무엇인가요? ,"위험관리(risk management)란 개인이나 조직이 직면한 위험, 즉 예상하지 못한 손실이 가져올 수 있는 좋지 않은 영향의 최소화 목적으로 행하여지는 조직적·체계적 활동으로 정의할 수 있다. 즉, 위험관리는 합리적이고 과학적인 원칙하에 일관성 있게 이루어진다는 의미에서 체계적인 경영활동의 한 형태라고 할 수 있다. 위험은 잠재적인 손실의 가능성으로 정의할 수 있으므로 위험의 크기는 잠재적인 손실발생의 빈도와 발생한 손실의 강도라는 두 가지 요소로 구분해서 생각해 볼 수 있다. 따라서 위험의 크기와 관련된 잠재적 손실의 총규모는 손실의 빈도와 강도의 곱으로 생각할 수 있다. 위험의 크기 = 손실의 빈도(frequency) × 손실의 강도(severity) 따라서 손실의 빈도와 손실의 강도는 위험에 대한 대응방법, 즉 위험의 관리방법을 결정하는 데 중요한 기본적인 고려사항이 된다. 따라서 위험을 이러한 두 요소에 따라 4가지 유형의 위험으로 나누어 생각해 볼 수 있다. 7가지 기본유형 중에서 유형Ⅰ은 잠재적 손실발생빈도와 발생한 손실의 규모가 모두 큰 경우를 말한다.",위험의 크기 = 손실의 빈도(frequency) × 손실의 강도(severity),328.0,373.0,811
812,유형Ⅰ 위험은 어떤 특징을 가지고 있나요? ,"위험관리(risk management)란 개인이나 조직이 직면한 위험, 즉 예상하지 못한 손실이 가져올 수 있는 좋지 않은 영향의 최소화 목적으로 행하여지는 조직적·체계적 활동으로 정의할 수 있다. 즉, 위험관리는 합리적이고 과학적인 원칙하에 일관성 있게 이루어진다는 의미에서 체계적인 경영활동의 한 형태라고 할 수 있다. 위험은 잠재적인 손실의 가능성으로 정의할 수 있으므로 위험의 크기는 잠재적인 손실발생의 빈도와 발생한 손실의 강도라는 두 가지 요소로 구분해서 생각해 볼 수 있다. 따라서 위험의 크기와 관련된 잠재적 손실의 총규모는 손실의 빈도와 강도의 곱으로 생각할 수 있다. 위험의 크기 = 손실의 빈도(frequency) × 손실의 강도(severity) 따라서 손실의 빈도와 손실의 강도는 위험에 대한 대응방법, 즉 위험의 관리방법을 결정하는 데 중요한 기본적인 고려사항이 된다. 따라서 위험을 이러한 두 요소에 따라 4가지 유형의 위험으로 나누어 생각해 볼 수 있다. 4가지 기본유형 중에서 유형Ⅰ은 잠재적 손실발생빈도와 발생한 손실의 규모가 모두 큰 경우를 말한다.",유형Ⅰ은 잠재적 손실발생빈도와 발생한 손실의 규모가 모두 큰 경우를 말한다.,508.0,550.0,812
813,유형Ⅱ 위험은 어떤 특징을 가지고 있나요?,이에 비해서 유형Ⅱ는 손실의 발생빈도는 낮으나 손실이 발생하면 그 규모가 매우 큰 위험이다. 유형Ⅲ은 손실의 발생빈도는 매우 높지만 손실의 규모는 그다지 크지 않은 경우이고 유형Ⅳ는 손실의 빈도와 강도가 모두 낮은 경우이다. 4가지 위험의 유형 따라 위험관리의 방법도 상이할 수 있다. 유형Ⅰ의 위험은 조직이나 개인에게 사활의 문제가 되는 중대한 위험으로서 이러한 위험은 가급적 피하는 것이 바람직하다(위험 회피). 유형Ⅱ의 위험은 상대적으로 예상하기 곤란하고 그 결과는 부담하기 어려울 정도로 큰 위험으로서 이러한 위험은 스스로 부담하기보다는 보험 등을 통하여 제3자에게 전가하는 편이 바람직하다(위험 전가). 유형Ⅲ은 상대적으로 예측하기 쉬운 일상적인 위험으로 볼 수 있으며 적극적인 사전예방이나 사후적 손실의 경감책으로 대응하기 용이한 위험이라고 볼 수 있다(위험 통제: risk control). 위험통제의 방법은 손실의 발생빈도의 축소에 초점을 준 손실예방(loss prevention)과 발생한 손실의 규모의 축소에 초점을 둔 손실감소(loss reduction)로 구분된다. 유형Ⅳ는 예측이 곤란하지만 결과가 사소한 일상적으로 발생하는 번잡한 위험들로서 사전적 대비보다는 그때그때 적절히 대응하는 위험보유의 방법이 적당하다(위험 보유: risk retention).,유형Ⅱ는 손실의 발생빈도는 낮으나 손실이 발생하면 그 규모가 매우 큰 위험이다.,7.0,51.0,813
814,유형Ⅲ 위험은 어떤 특징을 가지고 있나요?,이에 비해서 유형Ⅱ는 손실의 발생빈도는 낮으나 손실이 발생하면 그 규모가 매우 큰 위험이다. 유형Ⅲ은 손실의 발생빈도는 매우 높지만 손실의 규모는 그다지 크지 않은 경우이고 유형Ⅳ는 손실의 빈도와 강도가 모두 낮은 경우이다. 4가지 위험의 유형 따라 위험관리의 방법도 상이할 수 있다. 유형Ⅰ의 위험은 조직이나 개인에게 사활의 문제가 되는 중대한 위험으로서 이러한 위험은 가급적 피하는 것이 바람직하다(위험 회피). 유형Ⅱ의 위험은 상대적으로 예상하기 곤란하고 그 결과는 부담하기 어려울 정도로 큰 위험으로서 이러한 위험은 스스로 부담하기보다는 보험 등을 통하여 제3자에게 전가하는 편이 바람직하다(위험 전가). 유형Ⅲ은 상대적으로 예측하기 쉬운 일상적인 위험으로 볼 수 있으며 적극적인 사전예방이나 사후적 손실의 경감책으로 대응하기 용이한 위험이라고 볼 수 있다(위험 통제: risk control). 위험통제의 방법은 손실의 발생빈도의 축소에 초점을 준 손실예방(loss prevention)과 발생한 손실의 규모의 축소에 초점을 둔 손실감소(loss reduction)로 구분된다. 유형Ⅳ는 예측이 곤란하지만 결과가 사소한 일상적으로 발생하는 번잡한 위험들로서 사전적 대비보다는 그때그때 적절히 대응하는 위험보유의 방법이 적당하다(위험 보유: risk retention).,유형Ⅳ는 손실의 빈도와 강도가 모두 낮은 경우이다.,97.0,125.0,814
815,"위험통제 방법은 무엇이며, 어떤 두 가지로 구분되나요? ",이에 비해서 유형Ⅱ는 손실의 발생빈도는 낮으나 손실이 발생하면 그 규모가 매우 큰 위험이다. 유형Ⅲ은 손실의 발생빈도는 매우 높지만 손실의 규모는 그다지 크지 않은 경우이고 유형Ⅳ는 손실의 빈도와 강도가 모두 낮은 경우이다. 4가지 위험의 유형 따라 위험관리의 방법도 상이할 수 있다. 유형Ⅰ의 위험은 조직이나 개인에게 사활의 문제가 되는 중대한 위험으로서 이러한 위험은 가급적 피하는 것이 바람직하다(위험 회피). 유형Ⅱ의 위험은 상대적으로 예상하기 곤란하고 그 결과는 부담하기 어려울 정도로 큰 위험으로서 이러한 위험은 스스로 부담하기보다는 보험 등을 통하여 제3자에게 전가하는 편이 바람직하다(위험 전가). 유형Ⅲ은 상대적으로 예측하기 쉬운 일상적인 위험으로 볼 수 있으며 적극적인 사전예방이나 사후적 손실의 경감책으로 대응하기 용이한 위험이라고 볼 수 있다(위험 통제: risk control). 위험통제의 방법은 손실의 발생빈도의 축소에 초점을 준 손실예방(loss prevention)과 발생한 손실의 규모의 축소에 초점을 둔 손실감소(loss reduction)로 구분된다. 유형Ⅳ는 예측이 곤란하지만 결과가 사소한 일상적으로 발생하는 번잡한 위험들로서 사전적 대비보다는 그때그때 적절히 대응하는 위험보유의 방법이 적당하다(위험 보유: risk retention).,위험통제의 방법은 손실의 발생빈도의 축소에 초점을 준 손실예방(loss prevention)과 발생한 손실의 규모의 축소에 초점을 둔 손실감소(loss reduction)로 구분된다.,450.0,552.0,815
816,유형Ⅳ 위험은 어떤 특징을 가지고 있나요?,이에 비해서 유형Ⅱ는 손실의 발생빈도는 낮으나 손실이 발생하면 그 규모가 매우 큰 위험이다. 유형Ⅲ은 손실의 발생빈도는 매우 높지만 손실의 규모는 그다지 크지 않은 경우이고 유형Ⅳ는 손실의 빈도와 강도가 모두 낮은 경우이다. 4가지 위험의 유형 따라 위험관리의 방법도 상이할 수 있다. 유형Ⅰ의 위험은 조직이나 개인에게 사활의 문제가 되는 중대한 위험으로서 이러한 위험은 가급적 피하는 것이 바람직하다(위험 회피). 유형Ⅱ의 위험은 상대적으로 예상하기 곤란하고 그 결과는 부담하기 어려울 정도로 큰 위험으로서 이러한 위험은 스스로 부담하기보다는 보험 등을 통하여 제3자에게 전가하는 편이 바람직하다(위험 전가). 유형Ⅲ은 상대적으로 예측하기 쉬운 일상적인 위험으로 볼 수 있으며 적극적인 사전예방이나 사후적 손실의 경감책으로 대응하기 용이한 위험이라고 볼 수 있다(위험 통제: risk control).,유형Ⅲ은 손실의 발생빈도는 매우 높지만 손실의 규모는 그다지 크지 않은 경우이고 유형Ⅳ는 손실의 빈도와 강도가 모두 낮은 경우이다. 4가지 위험의 유형 따라 위험관리의 방법도 상이할 수 있다,52.0,158.0,816
817,"위험보유의 방법은 무엇이며, 왜 이 방법을 선택할 수 있을까요? ","적극적인 위험보유는 위험관리계획에 따라 행하여지는 행위로서 차입금에 의한 방법과 자기자금에 의한 방법이 있다. 위험보유를 선택하는 이유는 위험을 보유하는 편이 다른 처리방법보다 비용이 적게 들거나, 위험이 특수하여 보험시장이 형성되지 않거나, 손실액이 적어 보험청구에 드는 시간과 경비 등이 손실액에 비하여 높기 때문이다.","위험을 보유하는 편이 다른 처리방법보다 비용이 적게 들거나, 위험이 특수하여 보험시장이 형성되지 않거나, 손실액이 적어 보험청구에 드는 시간과 경비 등이 손실액에 비하여 높기 때문이다.",77.0,180.0,817
818,보험은 어떤 사회적 장치나 제도로 정의되나요? ,"보험은 비슷한 위험에 처한 사람들이 자신의 위험을 제3자(보험회사)에게 전가하는 사회적 장치나 제도이다. 보험을 통해 각자가 겪을 수 있는 손실을 한데 묶음으로써 손실의 통계적 예측을 가능하게 하고, 자신의 위험을 제3자에게 전가하는 대가로 지불하는 보험료(premium)로 발생손실을 보상해준다. 각종 위험에 대하여 공동으로 대응하여 손실의 회복을 꾀하는 보험과 유사한 제도는 고대사회에서부터 존재하였다. 현대적 보험은 화폐경제가 발전하고 여러 가지 잠재적 위험들에 대하여 스스로 책임지는 시장경제가 발전한 이후 등장하였다. 즉, 보험은 발생한 손실을 평가하고 손실을 보상할 공통의 수단이 있어야 하는데 물물교환과 같은 경제하에서는 이러한 평가나 보상이 불가능하기 때문이었다. 보험은 자신의 생활이나 사업과 관련된 위험을 자발적으로 관리하려는 의지가 없으면 발전하기 어렵다. 이러한 점은 대부분의 위험은 보장해 주는 사회주의 국가에서 보험이 거의 발전하지 못한 것을 보아도 알 수 있다.",보험은 비슷한 위험에 처한 사람들이 자신의 위험을 제3자(보험회사)에게 전가하는 사회적 장치나 제도이다.,0.0,58.0,818
819,보험은 어떤 종류의 위험에 대하여 대응하는 제도인가요? ,"보험은 비슷한 위험에 처한 사람들이 자신의 위험을 제3자(보험회사)에게 전가하는 사회적 장치나 제도이다. 보험을 통해 각자가 겪을 수 있는 손실을 한데 묶음으로써 손실의 통계적 예측을 가능하게 하고, 자신의 위험을 제6자에게 전가하는 대가로 지불하는 보험료(premium)로 발생손실을 보상해준다. 각종 위험에 대하여 공동으로 대응하여 손실의 회복을 꾀하는 보험과 유사한 제도는 고대사회에서부터 존재하였다. 현대적 보험은 화폐경제가 발전하고 여러 가지 잠재적 위험들에 대하여 스스로 책임지는 시장경제가 발전한 이후 등장하였다. 즉, 보험은 발생한 손실을 평가하고 손실을 보상할 공통의 수단이 있어야 하는데 물물교환과 같은 경제하에서는 이러한 평가나 보상이 불가능하기 때문이었다. 보험은 자신의 생활이나 사업과 관련된 위험을 자발적으로 관리하려는 의지가 없으면 발전하기 어렵다. 이러한 점은 대부분의 위험은 보장해 주는 사회주의 국가에서 보험이 거의 발전하지 못한 것을 보아도 알 수 있다.",보험은 비슷한 위험에 처한 사람들이 자신의 위험을 제3자(보험회사)에게 전가하는 사회적 장치나 제도이다.,0.0,58.0,819
820,보험이 발전하기 어렵다고 할 수 있는 상황은 어떤 경우인가요? ,"보험은 비슷한 위험에 처한 사람들이 자신의 위험을 제3자(보험회사)에게 전가하는 사회적 장치나 제도이다. 보험을 통해 각자가 겪을 수 있는 손실을 한데 묶음으로써 손실의 통계적 예측을 가능하게 하고, 자신의 위험을 제3자에게 전가하는 대가로 지불하는 보험료(premium)로 발생손실을 보상해준다. 각종 위험에 대하여 공동으로 대응하여 손실의 회복을 꾀하는 보험과 유사한 제도는 고대사회에서부터 존재하였다. 현대적 보험은 화폐경제가 발전하고 여러 가지 잠재적 위험들에 대하여 스스로 책임지는 시장경제가 발전한 이후 등장하였다. 즉, 보험은 발생한 손실을 평가하고 손실을 보상할 공통의 수단이 있어야 하는데 물물교환과 같은 경제하에서는 이러한 평가나 보상이 불가능하기 때문이었다. 보험은 자신의 생활이나 사업과 관련된 위험을 자발적으로 관리하려는 의지가 없으면 발전하기 어렵다. 이러한 점은 대부분의 위험은 보장해 주는 사회주의 국가에서 보험이 거의 발전하지 못한 것을 보아도 알 수 있다.",보험은 자신의 생활이나 사업과 관련된 위험을 자발적으로 관리하려는 의지가 없으면 발전하기 어렵다.,380.0,434.0,820
821,근대적 보험은 어떤 수학적 발전을 기반으로 가능해졌나요? ,"국가와 같은 제3자가 위험을 부담해 주는 상황에서는 위험에 대한 인식이 약화되며 적극적으로 위험을 관리하려는 의지도 약해질 수 있기 때문이다. 보험은 또한 위험에 대한 계산을 기초로 한다. 따라서 근대적 보험은 불확실성을 측정하는 도구로서 확률론의 발전, 구체적으로 대수의 법칙과 통계학의 발전으로 가능했다. 확률론은 다른 수학에 비해 발전이 특히 늦어서 17세기에 와서 파스칼(Pascal) 등에 의하여 창안되었으며, 대수의 법칙은 18세기의 베르누이(J.Bernoulli)에 의하여 확립되었다. 그후 이러한 수학의 발전을 기반으로 근대적 형태의 생명표가 영국의 수학자이며 천문학자인 헬리(Halley)에 의하여 처음으로 작성되었고 이후 근대적 보험은 영국과 미국을 중심으로 급속히 발전하였다. 근대 보험의 기원이 되는 곳은 바로 영국 런던의 로이즈 커피하우스다. 로이즈 커피하우스는 1687년경 사무엘 로이드(Samuel Lloyd)가 처음 문을 열었고, 그의 아들 에드워드 로이드(Edward Lloyd)가 물려받으면서 점차 사업가나 학생뿐만 아니라 항해와 관련된 사람들의 모임장소로 발전하였다.","근대적 보험은 불확실성을 측정하는 도구로서 확률론의 발전, 구체적으로 대수의 법칙과 통계학의 발전으로 가능했다.",110.0,172.0,821
822,"확률론의 발전은 어떤 수학자에 의해 시작되었으며, 어떤 법칙이 발전에 중요한 역할을 했나요? ","국가와 같은 제3자가 위험을 부담해 주는 상황에서는 위험에 대한 인식이 약화되며 적극적으로 위험을 관리하려는 의지도 약해질 수 있기 때문이다. 보험은 또한 위험에 대한 계산을 기초로 한다. 따라서 근대적 보험은 불확실성을 측정하는 도구로서 확률론의 발전, 구체적으로 대수의 법칙과 통계학의 발전으로 가능했다. 확률론은 다른 수학에 비해 발전이 특히 늦어서 17세기에 와서 파스칼(Pascal) 등에 의하여 창안되었으며, 대수의 법칙은 18세기의 베르누이(J.Bernoulli)에 의하여 확립되었다. 그후 이러한 수학의 발전을 기반으로 근대적 형태의 생명표가 영국의 수학자이며 천문학자인 헬리(Halley)에 의하여 처음으로 작성되었고 이후 근대적 보험은 영국과 미국을 중심으로 급속히 발전하였다. 근대 보험의 기원이 되는 곳은 바로 영국 런던의 로이즈 커피하우스다. 로이즈 커피하우스는 1688년경 사무엘 로이드(Samuel Lloyd)가 처음 문을 열었고, 그의 아들 에드워드 로이드(Edward Lloyd)가 물려받으면서 점차 사업가나 학생뿐만 아니라 항해와 관련된 사람들의 모임장소로 발전하였다.","확률론은 다른 수학에 비해 발전이 특히 늦어서 17세기에 와서 파스칼(Pascal) 등에 의하여 창안되었으며, 대수의 법칙은 18세기의 베르누이(J.Bernoulli)에 의하여 확립되었다.",173.0,278.0,822
823,근대적 형태의 생명표는 어떤 수학자에 의해 처음 작성되었나요? ,"국가와 같은 제3자가 위험을 부담해 주는 상황에서는 위험에 대한 인식이 약화되며 적극적으로 위험을 관리하려는 의지도 약해질 수 있기 때문이다. 보험은 또한 위험에 대한 계산을 기초로 한다. 따라서 근대적 보험은 불확실성을 측정하는 도구로서 확률론의 발전, 구체적으로 대수의 법칙과 통계학의 발전으로 가능했다. 확률론은 다른 수학에 비해 발전이 특히 늦어서 17세기에 와서 파스칼(Pascal) 등에 의하여 창안되었으며, 대수의 법칙은 18세기의 베르누이(J.Bernoulli)에 의하여 확립되었다. 그후 이러한 수학의 발전을 기반으로 근대적 형태의 생명표가 영국의 수학자이며 천문학자인 헬리(Halley)에 의하여 처음으로 작성되었고 이후 근대적 보험은 영국과 미국을 중심으로 급속히 발전하였다. 근대 보험의 기원이 되는 곳은 바로 영국 런던의 로이즈 커피하우스다. 로이즈 커피하우스는 1689년경 사무엘 로이드(Samuel Lloyd)가 처음 문을 열었고, 그의 아들 에드워드 로이드(Edward Lloyd)가 물려받으면서 점차 사업가나 학생뿐만 아니라 항해와 관련된 사람들의 모임장소로 발전하였다.",수학자이며 천문학자인 헬리(Halley)에 의하여 처음으로 작성,316.0,351.0,823
824,근대적 보험의 기원이 된 장소는 어디인가요?,"국가와 같은 제3자가 위험을 부담해 주는 상황에서는 위험에 대한 인식이 약화되며 적극적으로 위험을 관리하려는 의지도 약해질 수 있기 때문이다. 보험은 또한 위험에 대한 계산을 기초로 한다. 따라서 근대적 보험은 불확실성을 측정하는 도구로서 확률론의 발전, 구체적으로 대수의 법칙과 통계학의 발전으로 가능했다. 확률론은 다른 수학에 비해 발전이 특히 늦어서 17세기에 와서 파스칼(Pascal) 등에 의하여 창안되었으며, 대수의 법칙은 18세기의 베르누이(J.Bernoulli)에 의하여 확립되었다. 그후 이러한 수학의 발전을 기반으로 근대적 형태의 생명표가 영국의 수학자이며 천문학자인 헬리(Halley)에 의하여 처음으로 작성되었고 이후 근대적 보험은 영국과 미국을 중심으로 급속히 발전하였다. 근대 보험의 기원이 되는 곳은 바로 영국 런던의 로이즈 커피하우스다. 로이즈 커피하우스는 1690년경 사무엘 로이드(Samuel Lloyd)가 처음 문을 열었고, 그의 아들 에드워드 로이드(Edward Lloyd)가 물려받으면서 점차 사업가나 학생뿐만 아니라 항해와 관련된 사람들의 모임장소로 발전하였다.",근대 보험의 기원이 되는 곳은 바로 영국 런던의 로이즈 커피하우스다.,390.0,428.0,824
