question_id,question,context,answer,answer_start,answer_end,title
538,한국장학재단은 어떤 목적으로 학자금 대출 프로그램을 운영하고 있나요?,"교육 불평등이 경제적 불평등으로 연결될 가능성을 최소화하기 위해 정부의 지원하에 한국장학재단이 다양한 학자금 대출 프로그램을 운영하고 있다. '일반상환 학자금 대출'은 소득 9~10분위의 대학생이나 대학원생에게 학자금을 대출해주고 거치기간 동안은 이자만 내게 하고 상환 기간이 도래한 후에 원리금을 분할하여 상환하도록 하는 제도를 말한다. 일반상환 대출은 신용도에 따라 대출의 제한이 있고 대학이나 대학원별로 대출금의 상한이 있으며 대출기한은 거치기간과 상환기간 각각 10년의 총 20년까지이다. 2010년부터 도입된 '든든 학자금 대출'은 한국장학재단을 통하여 제공되는 학자금 대출로 신용등급에 상관없이 만 35세 이하로 소득분위가 1~8분위 이하의 대학생이면 누구나 받을 수 있다. 물론 장학금 성격이 있기 때문에 학점 취득, 학점기준 등에서 최소한의 제한이 따른다. 그러나 등록금 전액과 연간 300만원의 생활비까지 대출해주고 적용 이자율이 낮기 때문에 다른 대출보다 대학생에게 유리한 대출제도이다.",교육 불평등이 경제적 불평등으로 연결될 가능성을 최소화하기 위해 정부의 지원하에 한국장학재단이 다양한 학자금 대출 프로그램을 운영하고 있다.,0.0,78.0,538
539,'일반상환 학자금 대출'은 어떤 대상을 위한 대출 제도인가요?,"교육 불평등이 경제적 불평등으로 연결될 가능성을 최소화하기 위해 정부의 지원하에 한국장학재단이 다양한 학자금 대출 프로그램을 운영하고 있다. '일반상환 학자금 대출'은 소득 9~10분위의 대학생이나 대학원생에게 학자금을 대출해주고 거치기간 동안은 이자만 내게 하고 상환 기간이 도래한 후에 원리금을 분할하여 상환하도록 하는 제도를 말한다. 일반상환 대출은 신용도에 따라 대출의 제한이 있고 대학이나 대학원별로 대출금의 상한이 있으며 대출기한은 거치기간과 상환기간 각각 10년의 총 20년까지이다. 2010년부터 도입된 '든든 학자금 대출'은 한국장학재단을 통하여 제공되는 학자금 대출로 신용등급에 상관없이 만 35세 이하로 소득분위가 1~8분위 이하의 대학생이면 누구나 받을 수 있다. 물론 장학금 성격이 있기 때문에 학점 취득, 학점기준 등에서 최소한의 제한이 따른다. 그러나 등록금 전액과 연간 300만원의 생활비까지 대출해주고 적용 이자율이 낮기 때문에 다른 대출보다 대학생에게 유리한 대출제도이다.",일반상환 학자금 대출'은 소득 9~10분위의 대학생이나 대학원생에게 학자금을 대출해주고 거치기간 동안은 이자만 내게 하고 상환 기간이 도래한 후에 원리금을 분할하여 상환하도록 하는 제도를 말한다.,80.0,189.0,539
540,일반상환 학자금 대출'의 거치기간 동안 내야 하는 것은 무엇인가요?,"교육 불평등이 경제적 불평등으로 연결될 가능성을 최소화하기 위해 정부의 지원하에 한국장학재단이 다양한 학자금 대출 프로그램을 운영하고 있다. '일반상환 학자금 대출'은 소득 9~10분위의 대학생이나 대학원생에게 학자금을 대출해주고 거치기간 동안은 이자만 내게 하고 상환 기간이 도래한 후에 원리금을 분할하여 상환하도록 하는 제도를 말한다. 일반상환 대출은 신용도에 따라 대출의 제한이 있고 대학이나 대학원별로 대출금의 상한이 있으며 대출기한은 거치기간과 상환기간 각각 10년의 총 20년까지이다. 2010년부터 도입된 '든든 학자금 대출'은 한국장학재단을 통하여 제공되는 학자금 대출로 신용등급에 상관없이 만 35세 이하로 소득분위가 1~8분위 이하의 대학생이면 누구나 받을 수 있다. 물론 장학금 성격이 있기 때문에 학점 취득, 학점기준 등에서 최소한의 제한이 따른다. 그러나 등록금 전액과 연간 300만원의 생활비까지 대출해주고 적용 이자율이 낮기 때문에 다른 대출보다 대학생에게 유리한 대출제도이다.",거치기간 동안은 이자만 내게 하고 상환 기간이 도래한 후에 원리금을 분할하여 상환,129.0,174.0,540
541,'일반상환 학자금 대출'의 대출기한은 어떻게 되나요?,"교육 불평등이 경제적 불평등으로 연결될 가능성을 최소화하기 위해 정부의 지원하에 한국장학재단이 다양한 학자금 대출 프로그램을 운영하고 있다. '일반상환 학자금 대출'은 소득 9~10분위의 대학생이나 대학원생에게 학자금을 대출해주고 거치기간 동안은 이자만 내게 하고 상환 기간이 도래한 후에 원리금을 분할하여 상환하도록 하는 제도를 말한다. 일반상환 대출은 신용도에 따라 대출의 제한이 있고 대학이나 대학원별로 대출금의 상한이 있으며 대출기한은 거치기간과 상환기간 각각 10년의 총 20년까지이다. 2010년부터 도입된 '든든 학자금 대출'은 한국장학재단을 통하여 제공되는 학자금 대출로 신용등급에 상관없이 만 35세 이하로 소득분위가 1~8분위 이하의 대학생이면 누구나 받을 수 있다. 물론 장학금 성격이 있기 때문에 학점 취득, 학점기준 등에서 최소한의 제한이 따른다. 그러나 등록금 전액과 연간 300만원의 생활비까지 대출해주고 적용 이자율이 낮기 때문에 다른 대출보다 대학생에게 유리한 대출제도이다.",대출기한은 거치기간과 상환기간 각각 10년의 총 20년까지이다.,242.0,277.0,541
542,'든든 학자금 대출'은 어떤 사람들이 받을 수 있는 대출인가요?,"교육 불평등이 경제적 불평등으로 연결될 가능성을 최소화하기 위해 정부의 지원하에 한국장학재단이 다양한 학자금 대출 프로그램을 운영하고 있다. '일반상환 학자금 대출'은 소득 9~10분위의 대학생이나 대학원생에게 학자금을 대출해주고 거치기간 동안은 이자만 내게 하고 상환 기간이 도래한 후에 원리금을 분할하여 상환하도록 하는 제도를 말한다. 일반상환 대출은 신용도에 따라 대출의 제한이 있고 대학이나 대학원별로 대출금의 상한이 있으며 대출기한은 거치기간과 상환기간 각각 10년의 총 20년까지이다. 2010년부터 도입된 '든든 학자금 대출'은 한국장학재단을 통하여 제공되는 학자금 대출로 신용등급에 상관없이 만 35세 이하로 소득분위가 1~8분위 이하의 대학생이면 누구나 받을 수 있다. 물론 장학금 성격이 있기 때문에 학점 취득, 학점기준 등에서 최소한의 제한이 따른다. 그러나 등록금 전액과 연간 300만원의 생활비까지 대출해주고 적용 이자율이 낮기 때문에 다른 대출보다 대학생에게 유리한 대출제도이다.",든든 학자금 대출'은 한국장학재단을 통하여 제공되는 학자금 대출로 신용등급에 상관없이 만 35세 이하로 소득분위가 1~8분위 이하의 대학생이면 누구나 받을 수 있다.,291.0,383.0,542
543,'든든 학자금 대출'은 어떤 제한이 있는 대출인가요?,"교육 불평등이 경제적 불평등으로 연결될 가능성을 최소화하기 위해 정부의 지원하에 한국장학재단이 다양한 학자금 대출 프로그램을 운영하고 있다. '일반상환 학자금 대출'은 소득 9~10분위의 대학생이나 대학원생에게 학자금을 대출해주고 거치기간 동안은 이자만 내게 하고 상환 기간이 도래한 후에 원리금을 분할하여 상환하도록 하는 제도를 말한다. 일반상환 대출은 신용도에 따라 대출의 제한이 있고 대학이나 대학원별로 대출금의 상한이 있으며 대출기한은 거치기간과 상환기간 각각 10년의 총 20년까지이다. 2010년부터 도입된 '든든 학자금 대출'은 한국장학재단을 통하여 제공되는 학자금 대출로 신용등급에 상관없이 만 35세 이하로 소득분위가 1~8분위 이하의 대학생이면 누구나 받을 수 있다. 물론 장학금 성격이 있기 때문에 학점 취득, 학점기준 등에서 최소한의 제한이 따른다. 그러나 등록금 전액과 연간 300만원의 생활비까지 대출해주고 적용 이자율이 낮기 때문에 다른 대출보다 대학생에게 유리한 대출제도이다.","장학금 성격이 있기 때문에 학점 취득, 학점기준 등에서 최소한의 제한이 따른다.",387.0,431.0,543
544,농어촌 출신 대학생을 위한 학자금 대출은 어떤 대상을 위한 대출인가요?,"농어촌 출신 대학생을 위한 학자금 대출은 농어업인 자녀들에게 고등교육 기회를 보장하기 위하여 실시하는 학자금 대출이기 때문에 이자가 없다. 든든 학자금과 같이 재학 중에는 상환 부담이 없고 졸업 또는 수료 후 2년 뒤부터 상환을 시작하는데 월별 균등 상환이다. 지원 자격은 농어업인 자녀이면서 농어촌에 주소를 둔 대학생이어야 한다. 이 역시 한국장학재단을 통하여 신청할 수 있다. 이 밖에도 한국장학재단(www.kosaf.go.kr)에서는 다양한 학자금 대출 제도가 있기 때문에 직접 방문하여 자신에게 적절한 학자금 대출을 알아볼 수 있다. 저소득·저신용 대학생 및 청년들의 경제적 부담을 줄여 자립을 지원하기 위해 대학생·청년을 위한 햇살론, 생활자금대출, 고금리 전환대출 등도 있다. 서민대출제도와 지원개념은 동일하나 지원내용은 대학생과 청년의 형편에 맞도록 조정되었다.",농어업인 자녀들에게 고등교육 기회를 보장하기 위하여 실시하는 학자금 대출,23.0,63.0,544
545,농어촌 출신 대학생을 위한 학자금 대출의 상환 방식은 어떻게 되나요?,"농어촌 출신 대학생을 위한 학자금 대출은 농어업인 자녀들에게 고등교육 기회를 보장하기 위하여 실시하는 학자금 대출이기 때문에 이자가 없다. 든든 학자금과 같이 재학 중에는 상환 부담이 없고 졸업 또는 수료 후 2년 뒤부터 상환을 시작하는데 월별 균등 상환이다. 지원 자격은 농어업인 자녀이면서 농어촌에 주소를 둔 대학생이어야 한다. 이 역시 한국장학재단을 통하여 신청할 수 있다. 이 밖에도 한국장학재단(www.kosaf.go.kr)에서는 다양한 학자금 대출 제도가 있기 때문에 직접 방문하여 자신에게 적절한 학자금 대출을 알아볼 수 있다. 저소득·저신용 대학생 및 청년들의 경제적 부담을 줄여 자립을 지원하기 위해 대학생·청년을 위한 햇살론, 생활자금대출, 고금리 전환대출 등도 있다. 서민대출제도와 지원개념은 동일하나 지원내용은 대학생과 청년의 형편에 맞도록 조정되었다.",든든 학자금과 같이 재학 중에는 상환 부담이 없고 졸업 또는 수료 후 2년 뒤부터 상환을 시작하는데 월별 균등 상환이다.,78.0,145.0,545
546,한국장학재단의 웹사이트에서 어떤 학자금 대출 제도에 대한 정보를 얻을 수 있나요?,"농어촌 출신 대학생을 위한 학자금 대출은 농어업인 자녀들에게 고등교육 기회를 보장하기 위하여 실시하는 학자금 대출이기 때문에 이자가 없다. 든든 학자금과 같이 재학 중에는 상환 부담이 없고 졸업 또는 수료 후 2년 뒤부터 상환을 시작하는데 월별 균등 상환이다. 지원 자격은 농어업인 자녀이면서 농어촌에 주소를 둔 대학생이어야 한다. 이 역시 한국장학재단을 통하여 신청할 수 있다. 이 밖에도 한국장학재단(www.kosaf.go.kr)에서는 다양한 학자금 대출 제도가 있기 때문에 직접 방문하여 자신에게 적절한 학자금 대출을 알아볼 수 있다. 저소득·저신용 대학생 및 청년들의 경제적 부담을 줄여 자립을 지원하기 위해 대학생·청년을 위한 햇살론, 생활자금대출, 고금리 전환대출 등도 있다. 서민대출제도와 지원개념은 동일하나 지원내용은 대학생과 청년의 형편에 맞도록 조정되었다.","다양한 학자금 대출 제도가 있기 때문에 직접 방문하여 자신에게 적절한 학자금 대출을 알아볼 수 있다. 저소득·저신용 대학생 및 청년들의 경제적 부담을 줄여 자립을 지원하기 위해 대학생·청년을 위한 햇살론, 생활자금대출, 고금리 전환대출 등도 있다.",246.0,384.0,546
547,저소득·저신용 대학생 및 청년들을 위한 어떤 학자금 대출 제도가 있나요?,"농어촌 출신 대학생을 위한 학자금 대출은 농어업인 자녀들에게 고등교육 기회를 보장하기 위하여 실시하는 학자금 대출이기 때문에 이자가 없다. 든든 학자금과 같이 재학 중에는 상환 부담이 없고 졸업 또는 수료 후 2년 뒤부터 상환을 시작하는데 월별 균등 상환이다. 지원 자격은 농어업인 자녀이면서 농어촌에 주소를 둔 대학생이어야 한다. 이 역시 한국장학재단을 통하여 신청할 수 있다. 이 밖에도 한국장학재단(www.kosaf.go.kr)에서는 다양한 학자금 대출 제도가 있기 때문에 직접 방문하여 자신에게 적절한 학자금 대출을 알아볼 수 있다. 저소득·저신용 대학생 및 청년들의 경제적 부담을 줄여 자립을 지원하기 위해 대학생·청년을 위한 햇살론, 생활자금대출, 고금리 전환대출 등도 있다. 서민대출제도와 지원개념은 동일하나 지원내용은 대학생과 청년의 형편에 맞도록 조정되었다.","대학생·청년을 위한 햇살론, 생활자금대출, 고금리 전환대출 등도 있다. 서민대출제도와 지원개념은 동일하나 지원내용은 대학생과 청년의 형편에 맞도록 조정되었다.",345.0,433.0,547
548,대출사기란 무엇인가요?,"대출사기란 대출을 빙자하여 돈을 갈취하는 사기를 말한다. 길을 가다가 보게 되는 '무담보 신용대출', '당일 대출 가능' 등이 적힌 전단지나 휴대폰을 통한 대출 안내 문자메시지 또는 전화 등은 대출사기의 전형적인 방법들이다. 이러한 대출사기는 서민들에게 다양한 피해를 입힌다는 점에서 문제가 있다. 우선, 대출을 알선해 주겠다며 돈을 요구하고, 돈을 받으면 연락을 끊고 잠적해 버리면 피해자는 대출을 받지 못하고 돈만 빼앗기게 된다. 또한 사기범들이 대출 상담 과정에서 수집한 대출신청자의 주민등록번호, 비밀번호 등 개인정보로 또 다른 불법행위를 일으킬 수 있고 이 경우 책임을 대출신청자가 지게 될 수 있다. 설사 사기범들로부터 실제로 자금을 대출을 받았다고 하더라도 실제로 이들이 받는 이자는 일반 금융회사의 이자보다 월등하게 높은 것이 보통이다. 따라서 대출사기의 유혹에 빠지지 않도록 조심해야 한다.",대출사기란 대출을 빙자하여 돈을 갈취하는 사기를 말한다.,0.0,31.0,548
549,대출사기의 전형적인 방법은 어떤 것들이 있나요?,"대출사기란 대출을 빙자하여 돈을 갈취하는 사기를 말한다. 길을 가다가 보게 되는 '무담보 신용대출', '당일 대출 가능' 등이 적힌 전단지나 휴대폰을 통한 대출 안내 문자메시지 또는 전화 등은 대출사기의 전형적인 방법들이다. 이러한 대출사기는 서민들에게 다양한 피해를 입힌다는 점에서 문제가 있다. 우선, 대출을 알선해 주겠다며 돈을 요구하고, 돈을 받으면 연락을 끊고 잠적해 버리면 피해자는 대출을 받지 못하고 돈만 빼앗기게 된다. 또한 사기범들이 대출 상담 과정에서 수집한 대출신청자의 주민등록번호, 비밀번호 등 개인정보로 또 다른 불법행위를 일으킬 수 있고 이 경우 책임을 대출신청자가 지게 될 수 있다. 설사 사기범들로부터 실제로 자금을 대출을 받았다고 하더라도 실제로 이들이 받는 이자는 일반 금융회사의 이자보다 월등하게 높은 것이 보통이다. 따라서 대출사기의 유혹에 빠지지 않도록 조심해야 한다.","길을 가다가 보게 되는 '무담보 신용대출', '당일 대출 가능' 등이 적힌 전단지나 휴대폰을 통한 대출 안내 문자메시지 또는 전화 등은 대출사기의 전형적인 방법들이다.",32.0,125.0,549
550,대출사기로 인해 어떤 피해가 발생할 수 있나요?,"대출사기란 대출을 빙자하여 돈을 갈취하는 사기를 말한다. 길을 가다가 보게 되는 '무담보 신용대출', '당일 대출 가능' 등이 적힌 전단지나 휴대폰을 통한 대출 안내 문자메시지 또는 전화 등은 대출사기의 전형적인 방법들이다. 이러한 대출사기는 서민들에게 다양한 피해를 입힌다는 점에서 문제가 있다. 우선, 대출을 알선해 주겠다며 돈을 요구하고, 돈을 받으면 연락을 끊고 잠적해 버리면 피해자는 대출을 받지 못하고 돈만 빼앗기게 된다. 또한 사기범들이 대출 상담 과정에서 수집한 대출신청자의 주민등록번호, 비밀번호 등 개인정보로 또 다른 불법행위를 일으킬 수 있고 이 경우 책임을 대출신청자가 지게 될 수 있다. 설사 사기범들로부터 실제로 자금을 대출을 받았다고 하더라도 실제로 이들이 받는 이자는 일반 금융회사의 이자보다 월등하게 높은 것이 보통이다. 따라서 대출사기의 유혹에 빠지지 않도록 조심해야 한다.","대출을 알선해 주겠다며 돈을 요구하고, 돈을 받으면 연락을 끊고 잠적해 버리면 피해자는 대출을 받지 못하고 돈만 빼앗기게 된다. 또한 사기범들이 대출 상담 과정에서 수집한 대출신청자의 주민등록번호, 비밀번호 등 개인정보로 또 다른 불법행위를 일으킬 수 있고 이 경우 책임을 대출신청자가 지게 될 수 있다.",171.0,341.0,550
551,'대출을 미끼로 한 금전 편취형' 대출사기는 어떤 유형인가요?,"먼저 '대출을 미끼로 한 금전 편취형'은 ① 신용등급이 낮아 대출이 어려우므로 공탁금, 보증금, 예치금, 보증보험료 등이 필요하다거나 ② 신용정보 조회기록이 많아 대출이 어렵다며 조회기록 삭제 또는 신용등급 상향조정 명목으로 전산작업비용이 필요하다거나 ③ 일정기간(예, 3개월)의 이자를 선납하거나 기존 대출금을 갚아야 대출이 가능하다며 금전을 요구하는 유형이다. 정상적인 금융회사는 대출을 해준다며 어떠한 명목으로도 선입금을 요구하지 않는다는 것을 명심할 필요가 있다. 캐피탈사 직원이라며 전화하여 '정부에서 신용이 어려운 분에게 서민대출을 취급하는 곳'이라면서 대출신청서를 요구한 후, '대출은 승인이 났는데 신용상태가 안 좋으니 서울대한법무사의 ○○○법무사에게 법원 공탁금을 보내라'고 함에 따라 총 180만원을 보냈으나 사기를 당했다. 대출은 받게 되었지만 중간에서 사기범이 대출을 가로채는 유형이다. 이러한 유형의 대출사기범들은 신용도가 낮아서 대출을 받기 어렵거나 여러 금융회사로부터 고금리 대출을 받고 있는 사람에게 접근해서 대출을 받게 해주겠다든지 고금리 대출을은행의 저금리 대출로 전환해 주겠다고 유혹한다.","① 신용등급이 낮아 대출이 어려우므로 공탁금, 보증금, 예치금, 보증보험료 등이 필요하다거나 ② 신용정보 조회기록이 많아 대출이 어렵다며 조회기록 삭제 또는 신용등급 상향조정 명목으로 전산작업비용이 필요하다거나 ③ 일정기간(예, 3개월)의 이자를 선납하거나 기존 대출금을 갚아야 대출이 가능하다며 금전을 요구하는 유형이다.",23.0,203.0,551
552,어떤 경우에 대출사기꾼이 피해자에게 접근하여 대출을 유도하나요?,"먼저 '대출을 미끼로 한 금전 편취형'은 ① 신용등급이 낮아 대출이 어려우므로 공탁금, 보증금, 예치금, 보증보험료 등이 필요하다거나 ② 신용정보 조회기록이 많아 대출이 어렵다며 조회기록 삭제 또는 신용등급 상향조정 명목으로 전산작업비용이 필요하다거나 ③ 일정기간(예, 3개월)의 이자를 선납하거나 기존 대출금을 갚아야 대출이 가능하다며 금전을 요구하는 유형이다. 정상적인 금융회사는 대출을 해준다며 어떠한 명목으로도 선입금을 요구하지 않는다는 것을 명심할 필요가 있다. 캐피탈사 직원이라며 전화하여 '정부에서 신용이 어려운 분에게 서민대출을 취급하는 곳'이라면서 대출신청서를 요구한 후, '대출은 승인이 났는데 신용상태가 안 좋으니 서울대한법무사의 ○○○법무사에게 법원 공탁금을 보내라'고 함에 따라 총 180만원을 보냈으나 사기를 당했다. 대출은 받게 되었지만 중간에서 사기범이 대출을 가로채는 유형이다. 이러한 유형의 대출사기범들은 신용도가 낮아서 대출을 받기 어렵거나 여러 금융회사로부터 고금리 대출을 받고 있는 사람에게 접근해서 대출을 받게 해주겠다든지 고금리 대출을은행의 저금리 대출로 전환해 주겠다고 유혹한다.",신용도가 낮아서 대출을 받기 어렵거나 여러 금융회사로부터 고금리 대출을 받고 있는 사람에게 접근,469.0,522.0,552
553,'전환대출'이 무엇인가요? 이에 따른 문제점은 무엇인가요?,"고금리 대출을 저금리로 전환하는 것을 '전환대출'이라고 하는데 이러한 대가로 중개수수료를 요구하거나 대출 전환과정에서 대출금을 가로채는 경우도 있다. 또한 사기꾼이 대출신청자의 서류를 위조 또는 변조하여 금융회사로부터 대출을 받게 해주고 대출 후 사기꾼이 대출금의 일부를 가로채는 경우도 있다. 사기꾼이 위조하는 서류는 재직증명서, 급여명세서, 보험증서, 급여통장 등인데 이런 서류를 위조하는 것은 문서위조죄에 해당되어 형사처벌을 받게 된다. 경우에 따라 대출신청자도 문서 위변조의 형사처벌을 받을 수 있으므로 이러한 사기에 속지 않도록 조심해야 한다. 사기범들은 고금리로 힘들어하는 대출자 A씨에게 접근해 우선 A씨의 대출금 1천만원을 대신 갚아주어 신용등급을 높여 놓고, 신용등급이 상향된 것을 이용하여 은행으로부터 A씨 명의로 2천만원을 대출받는다.",고금리 대출을 저금리로 전환하는 것을 '전환대출'이라고 하는데 이러한 대가로 중개수수료를 요구하거나 대출 전환과정에서 대출금을 가로채는 경우도 있다.,0.0,83.0,553
554,어떤 방식으로 사기꾼이 대출금을 가로채는 경우가 있을까요?,"고금리 대출을 저금리로 전환하는 것을 '전환대출'이라고 하는데 이러한 대가로 중개수수료를 요구하거나 대출 전환과정에서 대출금을 가로채는 경우도 있다. 또한 사기꾼이 대출신청자의 서류를 위조 또는 변조하여 금융회사로부터 대출을 받게 해주고 대출 후 사기꾼이 대출금의 일부를 가로채는 경우도 있다. 사기꾼이 위조하는 서류는 재직증명서, 급여명세서, 보험증서, 급여통장 등인데 이런 서류를 위조하는 것은 문서위조죄에 해당되어 형사처벌을 받게 된다. 경우에 따라 대출신청자도 문서 위변조의 형사처벌을 받을 수 있으므로 이러한 사기에 속지 않도록 조심해야 한다. 사기범들은 고금리로 힘들어하는 대출자 A씨에게 접근해 우선 A씨의 대출금 1천만원을 대신 갚아주어 신용등급을 높여 놓고, 신용등급이 상향된 것을 이용하여 은행으로부터 A씨 명의로 2천만원을 대출받는다.",사기꾼이 대출신청자의 서류를 위조 또는 변조하여 금융회사로부터 대출을 받게 해주고 대출 후 사기꾼이 대출금의 일부를 가로채는 경우,87.0,159.0,554
